fullName,name,gene_id,summary,Protein_Domains
DEAD-box helicase 3 X-linked,DDX3X,1417,"The protein encoded by this gene is a member of the large DEAD-box protein family, that is defined by the presence of the conserved Asp-Glu-Ala-Asp (DEAD) motif, and has ATP-dependent RNA helicase activity. This protein has been reported to display a high level of RNA-independent ATPase activity, and unlike most DEAD-box helicases, the ATPase activity is thought to be stimulated by both RNA and DNA. This protein has multiple conserved domains and is thought to play roles in both the nucleus and cytoplasm. Nuclear roles include transcriptional regulation, mRNP assembly, pre-mRNA splicing, and mRNA export. In the cytoplasm, this protein is thought to be involved in translation, cellular signaling, and viral replication. Misregulation of this gene has been implicated in tumorigenesis. This gene has a paralog located in the nonrecombining region of the Y chromosome. Pseudogenes sharing similarity to both this gene and the DDX3Y paralog are found on chromosome 4 and the X chromosome. Alternative splicing results in multiple transcript variants. [provided by RefSeq, Oct 2014].","['Helicase, C-terminal domain-like', 'P-loop containing nucleoside triphosphate hydrolase', 'ATP-dependent RNA helicase DEAD-box, conserved site', 'DEAD/DEAH box helicase domain', 'Helicase superfamily 1/2, ATP-binding domain', 'RNA helicase, DEAD-box type, Q motif']"
defensin alpha 1,DEFA1,1428,"Defensins are a family of antimicrobial and cytotoxic peptides thought to be involved in host defense. They are abundant in the granules of neutrophils and also found in the epithelia of mucosal surfaces such as those of the intestine, respiratory tract, urinary tract, and vagina. Members of the defensin family are highly similar in protein sequence and distinguished by a conserved cysteine motif. The protein encoded by this gene, defensin, alpha 1, is found in the microbicidal granules of neutrophils and likely plays a role in phagocyte-mediated host defense. Several alpha defensin genes are clustered on chromosome 8. This gene differs from defensin, alpha 3 by only one amino acid. This gene and the gene encoding defensin, alpha 3 are both subject to copy number variation. [provided by RefSeq, Oct 2014].","['Alpha-defensin, N-terminal', 'Beta/alpha-defensin, C-terminal', 'Alpha-defensin, C-terminal', 'Alpha-defensin']"
NAD(P)H quinone dehydrogenase 1,NQO1,1463,"This gene is a member of the NAD(P)H dehydrogenase (quinone) family and encodes a cytoplasmic 2-electron reductase. This FAD-binding protein forms homodimers and reduces quinones to hydroquinones. This protein's enzymatic activity prevents the one electron reduction of quinones that results in the production of radical species. Mutations in this gene have been associated with tardive dyskinesia (TD), an increased risk of hematotoxicity after exposure to benzene, and susceptibility to various forms of cancer. Altered expression of this protein has been seen in many tumors and is also associated with Alzheimer's disease (AD). Alternate transcriptional splice variants, encoding different isoforms, have been characterized. [provided by RefSeq, Jul 2008].","['Flavodoxin-like fold', 'Flavoprotein-like superfamily', 'NAD(P)H dehydrogenase (quinone)']"
DNA methyltransferase 1,DNMT1,1510,"This gene encodes an enzyme that transfers methyl groups to cytosine nucleotides of genomic DNA. This protein is the major enzyme responsible for maintaining methylation patterns following DNA replication and shows a preference for hemi-methylated DNA. Methylation of DNA is an important component of mammalian epigenetic gene regulation. Aberrant methylation patterns are found in human tumors and associated with developmental abnormalities. Variation in this gene has been associated with cerebellar ataxia, deafness, and narcolepsy, and neuropathy, hereditary sensory, type IE. Alternative splicing results in multiple transcript variants. [provided by RefSeq, Jan 2016].","['DMAP1-binding domain', 'Bromo adjacent homology (BAH) domain', 'C-5 cytosine methyltransferase', 'Zinc finger, CXXC-type', 'DNA (cytosine-5)-methyltransferase 1-like', 'DNA methylase, C-5 cytosine-specific, active site', 'DNA (cytosine-5)-methyltransferase 1, replication foci domain', 'S-adenosyl-L-methionine-dependent methyltransferase superfamily', 'DNA methylase, C-5 cytosine-specific, conserved site', 'Bromo adjacent homology (BAH) domain superfamily', 'DNA Cytosine-5 Methyltransferase']"
dihydropyrimidine dehydrogenase,DPYD,1526,"The protein encoded by this gene is a pyrimidine catabolic enzyme and the initial and rate-limiting factor in the pathway of uracil and thymidine catabolism. Mutations in this gene result in dihydropyrimidine dehydrogenase deficiency, an error in pyrimidine metabolism associated with thymine-uraciluria and an increased risk of toxicity in cancer patients receiving 5-fluorouracil chemotherapy. Two transcript variants encoding different isoforms have been found for this gene. [provided by RefSeq, May 2009].","['Dihydroorotate dehydrogenase, catalytic', 'Alpha-helical ferredoxin', 'Aldolase-type TIM barrel', '4Fe-4S ferredoxin-type, iron-sulphur binding domain', '4Fe-4S ferredoxin, iron-sulphur binding, conserved site', 'FAD/NAD(P)-binding domain', 'Dihydroprymidine dehydrogenase domain II', 'FAD/NAD(P)-binding domain superfamily']"
dopamine receptor D5,DRD5,1536,"This gene encodes the D5 subtype of the dopamine receptor. The D5 subtype is a G-protein coupled receptor which stimulates adenylyl cyclase. This receptor is expressed in neurons in the limbic regions of the brain. It has a 10-fold higher affinity for dopamine than the D1 subtype. Pseudogenes related to this gene reside on chromosomes 1 and 2. [provided by RefSeq, Jul 2008].","['G protein-coupled receptor, rhodopsin-like', 'Dopamine D5 receptor', 'Dopamine receptor family', 'GPCR, rhodopsin-like, 7TM']"
deltex E3 ubiquitin ligase 1,DTX1,1559,"Studies in Drosophila have identified this gene as encoding a positive regulator of the Notch-signaling pathway. The human gene encodes a protein of unknown function; however, it may play a role in basic helix-loop-helix transcription factor activity. [provided by RefSeq, Jul 2008].","['Zinc finger, RING-type', 'WWE domain', 'Zinc finger, RING/FYVE/PHD-type', 'WWE domain, subgroup', 'WWE domain superfamily', 'Deltex, C-terminal', 'Deltex family', 'Deltex, C-terminal domain superfamily']"
dual specificity phosphatase 2,DUSP2,1563,"The protein encoded by this gene is a member of the dual specificity protein phosphatase subfamily.  These phosphatases inactivate their target kinases by dephosphorylating both the phosphoserine/threonine and phosphotyrosine residues.  They negatively regulate members of the mitogen-activated protein (MAP) kinase superfamily (MAPK/ERK, SAPK/JNK, p38), which are associated with cellular proliferation and differentiation.  Different members of the family of dual specificity phosphatases show distinct substrate specificities for various MAP kinases, different tissue distribution and subcellular localization, and different modes of inducibility of their expression by extracellular stimuli.  This gene product inactivates ERK1 and ERK2, is predominantly expressed in hematopoietic tissues, and is localized in the nucleus. [provided by RefSeq, Jul 2008].","['Dual specificity phosphatase, catalytic domain', 'Tyrosine-specific protein phosphatases domain', 'Rhodanese-like domain', 'Protein-tyrosine phosphatase, catalytic', 'Mitogen-activated protein (MAP) kinase phosphatase', 'Protein-tyrosine phosphatase, active site', 'Dual specificity protein phosphatase domain', 'Protein-tyrosine phosphatase-like', 'Rhodanese-like domain superfamily']"
dual specificity phosphatase 6,DUSP6,1567,"The protein encoded by this gene is a member of the dual specificity protein phosphatase subfamily. These phosphatases inactivate their target kinases by dephosphorylating both the phosphoserine/threonine and phosphotyrosine residues. They negatively regulate members of the mitogen-activated protein (MAP) kinase superfamily (MAPK/ERK, SAPK/JNK, p38), which are associated with cellular proliferation and differentiation. Different members of the family of dual specificity phosphatases show distinct substrate specificities for various MAP kinases, different tissue distribution and subcellular localization, and different modes of inducibility of their expression by extracellular stimuli. This gene product inactivates ERK2, is expressed in a variety of tissues with the highest levels in heart and pancreas, and unlike most other members of this family, is localized in the cytoplasm. Mutations in this gene have been associated with congenital hypogonadotropic hypogonadism. Alternatively spliced transcript variants have been found for this gene. [provided by RefSeq, Jan 2014].","['Rhodanese-like domain', 'Rhodanese-like domain superfamily', 'Dual specificity phosphatase, catalytic domain', 'Tyrosine-specific protein phosphatases domain', 'Mitogen-activated protein (MAP) kinase phosphatase', 'Dual specificity protein phosphatase domain', 'Protein-tyrosine phosphatase-like']"
EBF transcription factor 1,EBF1,1590,"Predicted to enable DNA-binding transcription activator activity, RNA polymerase II-specific and RNA polymerase II cis-regulatory region sequence-specific DNA binding activity. Predicted to be involved in positive regulation of transcription by RNA polymerase II. Predicted to act upstream of or within positive regulation of transcription, DNA-templated. Predicted to be located in nucleus. Predicted to be part of chromatin. [provided by Alliance of Genome Resources, Apr 2022]","['IPT domain', 'Transcription factor COE', 'Immunoglobulin-like fold', 'Immunoglobulin E-set', 'Transcription factor COE, conserved site', 'Transcription factor COE, DNA-binding domain', 'Transcription factor COE, helix-loop-helix domain', 'Transcription factor COE, IPT domain', 'Transcription factor COE, DNA-binding domain superfamily']"
sphingosine-1-phosphate receptor 1,S1PR1,1603,"The protein encoded by this gene is structurally similar to G protein-coupled receptors and is highly expressed in endothelial cells. It binds the ligand sphingosine-1-phosphate with high affinity and high specificity, and suggested to be involved in the processes that regulate the differentiation of endothelial cells. Activation of this receptor induces cell-cell adhesion. Alternative splicing results in multiple transcript variants. [provided by RefSeq, Mar 2016].","['G protein-coupled receptor, rhodopsin-like', 'Sphingosine 1-phosphate receptor 1', 'Sphingosine 1-phosphate receptor', 'GPCR, rhodopsin-like, 7TM']"
ephrin A2,EFNA2,1627,"This gene encodes a member of the ephrin family. The protein is composed of a signal sequence, a receptor-binding region, a spacer region, and a hydrophobic region. The EPH and EPH-related receptors comprise the largest subfamily of receptor protein-tyrosine kinases and have been implicated in mediating developmental events, particularly in the nervous system. Based on their structures and sequence relationships, ephrins are divided into the ephrin-A (EFNA) class, which are anchored to the membrane by a glycosylphosphatidylinositol linkage, and the ephrin-B (EFNB) class, which are transmembrane proteins. Posttranslational modifications determine whether this protein localizes to the nucleus or the cytoplasm. [provided by RefSeq, Jul 2008].","['Ephrin receptor-binding domain', 'Cupredoxin', 'Ephrin, conserved site', 'Ephrin', 'Ephrin-A ectodomain']"
epidermal growth factor,EGF,1634,"This gene encodes a member of the epidermal growth factor superfamily. The encoded preproprotein is proteolytically processed to generate the 53-amino acid epidermal growth factor peptide. This protein acts a potent mitogenic factor that plays an important role in the growth, proliferation and differentiation of numerous cell types. This protein acts by binding with high affinity to the cell surface receptor, epidermal growth factor receptor. Defects in this gene are the cause of hypomagnesemia type 4. Dysregulation of this gene has been associated with the growth and progression of certain cancers. Alternative splicing results in multiple transcript variants, at least one of which encodes a preproprotein that is proteolytically processed. [provided by RefSeq, Jan 2016].","['LDLR class B repeat', 'EGF-type aspartate/asparagine hydroxylation site', 'EGF-like domain', 'EGF-like calcium-binding domain', 'Growth factor receptor cysteine-rich domain superfamily', 'Six-bladed beta-propeller, TolB-like', 'Pro-epidermal growth factor', 'EGF-like calcium-binding, conserved site', 'NOTCH1 EGF-like calcium-binding domain', 'Cueball/EGF/LRP/Nidogen']"
eukaryotic translation initiation factor 1A X-linked,EIF1AX,1646,"This gene encodes an essential eukaryotic translation initiation factor. The protein is required for the binding of the 43S complex (a 40S subunit, eIF2/GTP/Met-tRNAi and eIF3) to the 5' end of capped RNA. [provided by RefSeq, Jul 2008].","['Translation initiation factor 1A (eIF-1A)', 'RNA-binding domain, S1, IF1 type', 'Nucleic acid-binding, OB-fold', 'Translation initiation factor 1A (eIF-1A), conserved site']"
eukaryotic translation initiation factor 4A1,EIF4A1,1651,"Enables double-stranded RNA binding activity. Predicted to be involved in cytoplasmic translational initiation. Located in cytoplasm. [provided by Alliance of Genome Resources, Apr 2022]","['ATP-dependent RNA helicase DEAD-box, conserved site', 'Helicase, C-terminal domain-like', 'DEAD/DEAH box helicase domain', 'Helicase superfamily 1/2, ATP-binding domain', 'P-loop containing nucleoside triphosphate hydrolase', 'RNA helicase, DEAD-box type, Q motif', 'ATP-dependent RNA helicase eIF4A, DEAD-box helicase domain']"
eukaryotic translation initiation factor 4E binding protein 1,EIF4EBP1,1655,"This gene encodes one member of a family of translation repressor proteins. The protein directly interacts with eukaryotic translation initiation factor 4E (eIF4E), which is a limiting component of the multisubunit complex that recruits 40S ribosomal subunits to the 5' end of mRNAs. Interaction of this protein with eIF4E inhibits complex assembly and represses translation. This protein is phosphorylated in response to various signals including UV irradiation and insulin signaling, resulting in its dissociation from eIF4E and activation of mRNA translation. [provided by RefSeq, Jul 2008].",[]
solute carrier family 29 member 1 (Augustine blood group),SLC29A1,1701,"This gene is a member of the equilibrative nucleoside transporter family. The gene encodes a transmembrane glycoprotein that localizes to the plasma and mitochondrial membranes and mediates the cellular uptake of nucleosides from the surrounding medium. The protein is categorized as an equilibrative (as opposed to concentrative) transporter that is sensitive to inhibition by nitrobenzylthioinosine (NBMPR). Nucleoside transporters are required for nucleotide synthesis in cells that lack de novo nucleoside synthesis pathways, and are also necessary for the uptake of cytotoxic nucleosides used for cancer and viral chemotherapies. Multiple alternatively spliced variants, encoding the same protein, have been found for this gene. [provided by RefSeq, Jul 2008].","['Equilibrative nucleoside transporter', 'Nucleoside transporter ENT1/ENT2', 'MFS transporter superfamily']"
E1A binding protein p300,EP300,1704,"This gene encodes the adenovirus E1A-associated cellular p300 transcriptional co-activator protein. It functions as histone acetyltransferase that regulates transcription via chromatin remodeling and is important in the processes of cell proliferation and differentiation. It mediates cAMP-gene regulation by binding specifically to phosphorylated CREB protein. This gene has also been identified as a co-activator of HIF1A (hypoxia-inducible factor 1 alpha), and thus plays a role in the stimulation of hypoxia-induced genes such as VEGF. Defects in this gene are a cause of Rubinstein-Taybi syndrome and may also play a role in epithelial cancer. [provided by RefSeq, Jul 2008].","['Coactivator CBP, KIX domain', 'Histone acetyltransferase Rtt109/CBP', 'Coactivator CBP, KIX domain superfamily', 'Zinc finger, TAZ-type', 'Zinc finger, ZZ-type', 'Bromodomain', 'Nuclear receptor coactivator, interlocking', 'CREB-binding protein/p300, atypical RING domain', 'Zinc finger, RING/FYVE/PHD-type', 'Nuclear receptor coactivator, CREB-bp-like, interlocking', 'Bromodomain, conserved site', 'CBP/p300-type histone acetyltransferase domain', 'TAZ domain superfamily', 'Bromodomain-like superfamily', 'Nuclear receptor coactivator, CREB-bp-like, interlocking domain superfamily', 'CBP/p300, atypical RING domain superfamily', 'Zinc finger, ZZ-type superfamily']"
endothelial PAS domain protein 1,EPAS1,1705,"This gene encodes a transcription factor involved in the induction of genes regulated by oxygen, which is induced as oxygen levels fall. The encoded protein contains a basic-helix-loop-helix domain protein dimerization domain as well as a domain found in proteins in signal transduction pathways which respond to oxygen levels. Mutations in this gene are associated with erythrocytosis familial type 4. [provided by RefSeq, Nov 2009].","['PAS domain', 'Nuclear translocator', 'PAC motif', 'Myc-type, basic helix-loop-helix (bHLH) domain', 'PAS fold', 'HIF-1 alpha, C-terminal transactivation domain', 'Hypoxia-inducible factor, alpha subunit-like', 'PAS domain superfamily', 'Helix-loop-helix DNA-binding domain superfamily']"
EPH receptor B2,EPHB2,1719,"This gene encodes a member of the Eph receptor family of receptor tyrosine kinase transmembrane glycoproteins. These receptors are composed of an N-terminal glycosylated ligand-binding domain, a transmembrane region and an intracellular kinase domain. They bind ligands called ephrins and are involved in diverse cellular processes including motility, division, and differentiation. A distinguishing characteristic of Eph-ephrin signaling is that both receptors and ligands are competent to transduce a signaling cascade, resulting in bidirectional signaling. This protein belongs to a subgroup of the Eph receptors called EphB. Proteins of this subgroup are distinguished from other members of the family by sequence homology and preferential binding affinity for membrane-bound ephrin-B ligands. Allelic variants are associated with prostate and brain cancer susceptibility. Alternative splicing results in multiple transcript variants. [provided by RefSeq, May 2015].","['Ephrin receptor ligand binding domain', 'Tyrosine-protein kinase, receptor class V, conserved site', 'Fibronectin type III', 'Galactose-binding-like domain superfamily', 'Growth factor receptor cysteine-rich domain superfamily', 'Tyrosine-protein kinase ephrin type A/B receptor-like', 'Immunoglobulin-like fold', 'Ephrin type-B receptor 2, ligand binding domain', 'Fibronectin type III superfamily', 'Ephrin receptor tyrosine kinases', 'Protein kinase domain', 'Serine-threonine/tyrosine-protein kinase, catalytic domain', 'Sterile alpha motif domain', 'Tyrosine-protein kinase, active site', 'Protein kinase-like domain superfamily', 'Sterile alpha motif/pointed domain superfamily', 'Ephrin receptor type-A /type-B', 'Protein kinase, ATP binding site', 'Tyrosine-protein kinase, catalytic domain', 'Ephrin receptor, transmembrane domain']"
EPH receptor B4,EPHB4,1721,"Ephrin receptors and their ligands, the ephrins, mediate numerous developmental processes, particularly in the nervous system. Based on their structures and sequence relationships, ephrins are divided into the ephrin-A (EFNA) class, which are anchored to the membrane by a glycosylphosphatidylinositol linkage, and the ephrin-B (EFNB) class, which are transmembrane proteins. The Eph family of receptors are divided into 2 groups based on the similarity of their extracellular domain sequences and their affinities for binding ephrin-A and ephrin-B ligands. Ephrin receptors make up the largest subgroup of the receptor tyrosine kinase (RTK) family. The protein encoded by this gene binds to ephrin-B2 and plays an essential role in vascular development. [provided by RefSeq, Jul 2008].","['Protein kinase domain', 'Ephrin receptor ligand binding domain', 'Serine-threonine/tyrosine-protein kinase, catalytic domain', 'Tyrosine-protein kinase, receptor class V, conserved site', 'Sterile alpha motif domain', 'Fibronectin type III', 'Tyrosine-protein kinase, active site', 'Galactose-binding-like domain superfamily', 'Growth factor receptor cysteine-rich domain superfamily', 'Protein kinase-like domain superfamily', 'Tyrosine-protein kinase ephrin type A/B receptor-like', 'Sterile alpha motif/pointed domain superfamily', 'Immunoglobulin-like fold', 'Ephrin receptor type-A /type-B', 'Protein kinase, ATP binding site', 'Tyrosine-protein kinase, catalytic domain', 'Ephrin receptor, transmembrane domain', 'Ephrin type-B receptor 4, ligand binding domain', 'Fibronectin type III superfamily', 'EPH-B4, SAM domain', 'Ephrin receptor tyrosine kinases']"
erythropoietin receptor,EPOR,1728,"This gene encodes the erythropoietin receptor which is a member of the cytokine receptor family. Upon erythropoietin binding, this receptor activates Jak2 tyrosine kinase which activates different intracellular pathways including: Ras/MAP kinase, phosphatidylinositol 3-kinase and STAT transcription factors. The stimulated erythropoietin receptor appears to have a role in erythroid cell survival. Defects in the erythropoietin receptor may produce erythroleukemia and familial erythrocytosis. Dysregulation of this gene may affect the growth of certain tumors. Alternate splicing results in multiple transcript variants.[provided by RefSeq, May 2010].","['Long hematopoietin receptor, single chain, conserved site', 'Fibronectin type III', 'Immunoglobulin-like fold', 'Growth hormone/erythropoietin receptor, ligand binding', 'Fibronectin type III superfamily', 'Erythropoietin receptor']"
erb-b2 receptor tyrosine kinase 3,ERBB3,1733,"This gene encodes a member of the epidermal growth factor receptor (EGFR) family of receptor tyrosine kinases. This membrane-bound protein has a neuregulin binding domain but not an active kinase domain. It therefore can bind this ligand but not convey the signal into the cell through protein phosphorylation. However, it does form heterodimers with other EGF receptor family members which do have kinase activity. Heterodimerization leads to the activation of pathways which lead to cell proliferation or differentiation. Amplification of this gene and/or overexpression of its protein have been reported in numerous cancers, including prostate, bladder, and breast tumors. Alternate transcriptional splice variants encoding different isoforms have been characterized. One isoform lacks the intermembrane region and is secreted outside the cell. This form acts to modulate the activity of the membrane-bound form. Additional splice variants have also been reported, but they have not been thoroughly characterized. [provided by RefSeq, Jul 2008].","['Serine-threonine/tyrosine-protein kinase, catalytic domain', 'Protein kinase-like domain superfamily', 'Receptor Tyrosine Kinase', 'Furin-like repeat', 'Growth factor receptor cysteine-rich domain superfamily', 'Tyrosine-protein kinase, catalytic domain', 'Growth factor receptor domain 4', 'Receptor L-domain superfamily', 'Receptor L-domain', 'Protein kinase domain', 'Furin-like cysteine-rich domain', 'Tyrosine protein kinase, EGF/ERB/XmrK receptor']"
erb-b2 receptor tyrosine kinase 4,ERBB4,1734,"This gene is a member of the Tyr protein kinase family and the epidermal growth factor receptor subfamily. It encodes a single-pass type I membrane protein with multiple cysteine rich domains, a transmembrane domain, a tyrosine kinase domain, a phosphotidylinositol-3 kinase binding site and a PDZ domain binding motif. The protein binds to and is activated by neuregulins and other factors and induces a variety of cellular responses including mitogenesis and differentiation. Multiple proteolytic events allow for the release of a cytoplasmic fragment and an extracellular fragment. Mutations in this gene have been associated with cancer. Alternatively spliced variants which encode different protein isoforms have been described; however, not all variants have been fully characterized. [provided by RefSeq, Jul 2008].","['Receptor L-domain', 'Receptor L-domain superfamily', 'Protein kinase domain', 'Serine-threonine/tyrosine-protein kinase, catalytic domain', 'Furin-like cysteine-rich domain', 'Furin-like repeat', 'Tyrosine-protein kinase, active site', 'Growth factor receptor cysteine-rich domain superfamily', 'Protein kinase-like domain superfamily', 'Tyrosine protein kinase, EGF/ERB/XmrK receptor', 'Protein kinase, ATP binding site', 'Tyrosine-protein kinase, catalytic domain', 'Growth factor receptor domain 4', 'Epidermal growth factor receptor-like, transmembrane-juxtamembrane segment', 'Receptor Tyrosine Kinase']"
