fullName,name,gene_id,summary,Protein_Domains
ALK receptor tyrosine kinase,ALK,1,"This gene encodes a receptor tyrosine kinase, which belongs to the insulin receptor superfamily. This protein comprises an extracellular domain, an hydrophobic stretch corresponding to a single pass transmembrane region, and an intracellular kinase domain. It plays an important role in the development of the brain and exerts its effects on specific neurons in the nervous system. This gene has been found to be rearranged, mutated, or amplified in a series of tumours including anaplastic large cell lymphomas, neuroblastoma, and non-small cell lung cancer. The chromosomal rearrangements are the most common genetic alterations in this gene, which result in creation of multiple fusion genes in tumourigenesis, including ALK (chromosome 2)/EML4 (chromosome 2), ALK/RANBP2 (chromosome 2), ALK/ATIC (chromosome 2), ALK/TFG (chromosome 3), ALK/NPM1 (chromosome 5), ALK/SQSTM1 (chromosome 5), ALK/KIF5B (chromosome 10), ALK/CLTC (chromosome 17), ALK/TPM4 (chromosome 19), and ALK/MSN (chromosome X).[provided by RefSeq, Jan 2011].","['Protein kinase domain', 'MAM domain', 'Serine-threonine/tyrosine-protein kinase, catalytic domain', 'Tyrosine-protein kinase, receptor class II, conserved site', 'Low-density lipoprotein (LDL) receptor class A repeat', 'Tyrosine-protein kinase, active site', 'Protein kinase-like domain superfamily', 'Concanavalin A-like lectin/glucanase domain superfamily', 'Protein kinase, ATP binding site', 'Tyrosine-protein kinase, catalytic domain', 'LDL receptor-like superfamily', 'Receptor Tyrosine Kinase']"
AKT serine/threonine kinase 1,AKT1,2,"This gene encodes one of the three members of the human AKT serine-threonine protein kinase family which are often referred to as protein kinase B alpha, beta, and gamma. These highly similar AKT proteins all have an N-terminal pleckstrin homology domain, a serine/threonine-specific kinase domain and a C-terminal regulatory domain. These proteins are phosphorylated by phosphoinositide 3-kinase (PI3K). AKT/PI3K forms a key component of many signalling pathways that involve the binding of membrane-bound ligands such as receptor tyrosine kinases, G-protein coupled receptors, and integrin-linked kinase. These AKT proteins therefore regulate a wide variety of cellular functions including cell proliferation, survival, metabolism, and angiogenesis in both normal and malignant cells. AKT proteins are recruited to the cell membrane by phosphatidylinositol 3,4,5-trisphosphate (PIP3) after phosphorylation of phosphatidylinositol 4,5-bisphosphate (PIP2) by PI3K. Subsequent phosphorylation of both threonine residue 308 and serine residue 473 is required for full activation of the AKT1 protein encoded by this gene. Phosphorylation of additional residues also occurs, for example, in response to insulin growth factor-1 and epidermal growth factor. Protein phosphatases act as negative regulators of AKT proteins by dephosphorylating AKT or PIP3. The PI3K/AKT signalling pathway is crucial for tumor cell survival. Survival factors can suppress apoptosis in a transcription-independent manner by activating AKT1 which then phosphorylates and inactivates components of the apoptotic machinery. AKT proteins also participate in the mammalian target of rapamycin (mTOR) signalling pathway which controls the assembly of the eukaryotic translation initiation factor 4F (eIF4E) complex and this pathway, in addition to responding to extracellular signals from growth factors and cytokines, is disregulated in many cancers. Mutations in this gene are associated with multiple types of cancer and excessive tissue growth including Proteus syndrome and Cowden syndrome 6, and breast, colorectal, and ovarian cancers. Multiple alternatively spliced transcript variants have been found for this gene. [provided by RefSeq, Jul 2020].","['Protein kinase domain', 'AGC-kinase, C-terminal', 'Pleckstrin homology domain', 'Serine/threonine-protein kinase, active site', 'Protein kinase-like domain superfamily', 'PH-like domain superfamily', 'Protein kinase, ATP binding site', 'Protein kinase, C-terminal', 'Protein kinase B alpha, catalytic domain', 'Protein Kinase B, pleckstrin homology domain']"
"A-Raf proto-oncogene, serine/threonine kinase",ARAF,3,"This proto-oncogene belongs to the RAF subfamily of the Ser/Thr protein kinase family, and maybe involved in cell growth and development. Alternatively spliced transcript variants encoding different isoforms have been found for this gene.[provided by RefSeq, Jan 2012]","['Protein kinase C-like, phorbol ester/diacylglycerol-binding domain', 'Raf-like Ras-binding', 'Diacylglycerol/phorbol-ester binding', 'Ubiquitin-like domain superfamily', 'C1-like domain superfamily', 'Protein kinase domain', 'Serine-threonine/tyrosine-protein kinase, catalytic domain', 'Serine/threonine-protein kinase, active site', 'Protein kinase-like domain superfamily', 'Protein kinase, ATP binding site', 'Serine/threonine-protein kinase']"
"ABL proto-oncogene 1, non-receptor tyrosine kinase",ABL1,4,"This gene is a protooncogene that encodes a protein tyrosine kinase involved in a variety of cellular processes, including cell division, adhesion, differentiation, and response to stress. The activity of the protein is negatively regulated by its SH3 domain, whereby deletion of the region encoding this domain results in an oncogene. The ubiquitously expressed protein has DNA-binding activity that is regulated by CDC2-mediated phosphorylation, suggesting a cell cycle function. This gene has been found fused to a variety of translocation partner genes in various leukemias, most notably the t(9;22) translocation that results in a fusion with the 5' end of the breakpoint cluster region gene (BCR; MIM:151410). Alternative splicing of this gene results in two transcript variants, which contain alternative first exons that are spliced to the remaining common exons. [provided by RefSeq, Aug 2014].","['Protein kinase domain', 'SH2 domain', 'Serine-threonine/tyrosine-protein kinase, catalytic domain', 'SH3 domain', 'Tyrosine-protein kinase, active site', 'Protein kinase-like domain superfamily', 'F-actin binding', 'Protein kinase, ATP binding site', 'Tyrosine-protein kinase, catalytic domain', 'Tyrosine-protein kinase ABL, SH2 domain', 'SH3-like domain superfamily', 'SH2 domain superfamily', 'Non-receptor tyrosine kinases involved in cell signaling']"
"B-Raf proto-oncogene, serine/threonine kinase",BRAF,5,"This gene encodes a protein belonging to the RAF family of serine/threonine protein kinases. This protein plays a role in regulating the MAP kinase/ERK signaling pathway, which affects cell division, differentiation, and secretion. Mutations in this gene, most commonly the V600E mutation, are the most frequently identified cancer-causing mutations in melanoma, and have been identified in various other cancers as well, including non-Hodgkin lymphoma, colorectal cancer, thyroid carcinoma, non-small cell lung carcinoma, hairy cell leukemia and adenocarcinoma of lung. Mutations in this gene are also associated with cardiofaciocutaneous, Noonan, and Costello syndromes, which exhibit overlapping phenotypes. A pseudogene of this gene has been identified on the X chromosome. [provided by RefSeq, Aug 2017].","['Protein kinase domain', 'Serine-threonine/tyrosine-protein kinase, catalytic domain', 'Protein kinase C-like, phorbol ester/diacylglycerol-binding domain', 'Raf-like Ras-binding', 'Serine/threonine-protein kinase, active site', 'Protein kinase-like domain superfamily', 'Protein kinase, ATP binding site', 'Diacylglycerol/phorbol-ester binding', 'Ubiquitin-like domain superfamily', 'C1-like domain superfamily', 'Serine/threonine-protein kinase']"
BRCA1 DNA repair associated,BRCA1,6,"This gene encodes a 190 kD nuclear phosphoprotein that plays a role in maintaining genomic stability, and it also acts as a tumor suppressor. The BRCA1 gene contains 22 exons spanning about 110 kb of DNA. The encoded protein combines with other tumor suppressors, DNA damage sensors, and signal transducers to form a large multi-subunit protein complex known as the BRCA1-associated genome surveillance complex (BASC). This gene product associates with RNA polymerase II, and through the C-terminal domain, also interacts with histone deacetylase complexes. This protein thus plays a role in transcription, DNA repair of double-stranded breaks, and recombination. Mutations in this gene are responsible for approximately 40% of inherited breast cancers and more than 80% of inherited breast and ovarian cancers. Alternative splicing plays a role in modulating the subcellular localization and physiological function of this gene. Many alternatively spliced transcript variants, some of which are disease-associated mutations, have been described for this gene, but the full-length natures of only some of these variants has been described. A related pseudogene, which is also located on chromosome 17, has been identified. [provided by RefSeq, May 2020].","['BRCT domain', 'Zinc finger, RING-type', 'Breast cancer type 1 susceptibility protein (BRCA1)', 'Zinc finger, RING/FYVE/PHD-type', 'Zinc finger, RING-type, conserved site', 'Zinc finger, C3HC4 RING-type', 'Zinc finger, RING-type, eukaryotic', 'BRCA1-associated', 'BRCT domain superfamily', 'BRCA1, serine-rich domain']"
BRCA2 DNA repair associated,BRCA2,7,"Inherited mutations in BRCA1 and this gene, BRCA2, confer increased lifetime risk of developing breast or ovarian cancer. Both BRCA1 and BRCA2 are involved in maintenance of genome stability, specifically the homologous recombination pathway for double-strand DNA repair. The largest exon in both genes is exon 11, which harbors the most important and frequent mutations in breast cancer patients. The BRCA2 gene was found on chromosome 13q12.3 in human. The BRCA2 protein contains several copies of a 70 aa motif called the BRC motif, and these motifs mediate binding to the RAD51 recombinase which functions in DNA repair. BRCA2 is considered a tumor suppressor gene, as tumors with BRCA2 mutations generally exhibit loss of heterozygosity (LOH) of the wild-type allele. [provided by RefSeq, May 2020].","['BRCA2 repeat', 'Nucleic acid-binding, OB-fold', 'BRCA2, OB1', 'BRCA2, OB3', 'Tower domain', 'Breast cancer type 2 susceptibility protein, helical domain', 'Breast cancer type 2 susceptibility protein', 'BRCA2 helical domain superfamily', 'BRCA2, OB2 domain']"
cyclin D1,CCND1,8,"The protein encoded by this gene belongs to the highly conserved cyclin family, whose members are characterized by a dramatic periodicity in protein abundance throughout the cell cycle. Cyclins function as regulators of CDK kinases. Different cyclins exhibit distinct expression and degradation patterns which contribute to the temporal coordination of each mitotic event. This cyclin forms a complex with and functions as a regulatory subunit of CDK4 or CDK6, whose activity is required for cell cycle G1/S transition. This protein has been shown to interact with tumor suppressor protein Rb and the expression of this gene is regulated positively by Rb. Mutations, amplification and overexpression of this gene, which alters cell cycle progression, are observed frequently in a variety of human cancers. [provided by RefSeq, Dec 2019].","['Cyclin, C-terminal domain', 'Cyclin, N-terminal', 'Cyclin-like domain', 'Cyclin-like superfamily', 'Cyclin', 'Cyclins, cyclin-box']"
cyclin D2,CCND2,9,"The protein encoded by this gene belongs to the highly conserved cyclin family, whose members are characterized by a dramatic periodicity in protein abundance through the cell cycle. Cyclins function as regulators of CDK kinases. Different cyclins exhibit distinct expression and degradation patterns which contribute to the temporal coordination of each mitotic event. This cyclin forms a complex with CDK4 or CDK6 and functions as a regulatory subunit of the complex, whose activity is required for cell cycle G1/S transition. This protein has been shown to interact with and be involved in the phosphorylation of tumor suppressor protein Rb. Knockout studies of the homologous gene in mouse suggest the essential roles of this gene in ovarian granulosa and germ cell proliferation. High level expression of this gene was observed in ovarian and testicular tumors. Mutations in this gene are associated with megalencephaly-polymicrogyria-polydactyly-hydrocephalus syndrome 3 (MPPH3). [provided by RefSeq, Sep 2014].","['Cyclin, C-terminal domain', 'Cyclin, N-terminal', 'Cyclin-like domain', 'Cyclin-like superfamily', 'Cyclin', 'Cyclins, cyclin-box']"
cyclin D3,CCND3,10,"The protein encoded by this gene belongs to the highly conserved cyclin family, whose members are characterized by a dramatic periodicity in protein abundance through the cell cycle. Cyclins function as regulators of CDK kinases. Different cyclins exhibit distinct expression and degradation patterns which contribute to the temporal coordination of each mitotic event. This cyclin forms a complex with and functions as a regulatory subunit of CDK4 or CDK6, whose activtiy is required for cell cycle G1/S transition. This protein has been shown to interact with and be involved in the phosphorylation of tumor suppressor protein Rb. The CDK4 activity associated with this cyclin was reported to be necessary for cell cycle progression through G2 phase into mitosis after UV radiation. Several transcript variants encoding different isoforms have been found for this gene. [provided by RefSeq, Oct 2008].","['Cyclin, N-terminal', 'Cyclin-like superfamily', 'Cyclin', 'Cyclin, C-terminal domain', 'Cyclin-like domain', 'Cyclins, cyclin-box']"
cyclin E1,CCNE1,11,"The protein encoded by this gene belongs to the highly conserved cyclin family, whose members are characterized by a dramatic periodicity in protein abundance through the cell cycle. Cyclins function as regulators of CDK kinases. Different cyclins exhibit distinct expression and degradation patterns which contribute to the temporal coordination of each mitotic event. This cyclin forms a complex with and functions as a regulatory subunit of CDK2, whose activity is required for cell cycle G1/S transition. This protein accumulates at the G1-S phase boundary and is degraded as cells progress through S phase. Overexpression of this gene has been observed in many tumors, which results in chromosome instability, and thus may contribute to tumorigenesis. This protein was found to associate with, and be involved in, the phosphorylation of NPAT protein (nuclear protein mapped to the ATM locus), which participates in cell-cycle regulated histone gene expression and plays a critical role in promoting cell-cycle progression in the absence of pRB. [provided by RefSeq, Apr 2016].","['Cyclin, C-terminal domain', 'Cyclin, N-terminal', 'Cyclin-like domain', 'Cyclin-like superfamily', 'Cyclin', 'Cyclins, cyclin-box']"
cyclin dependent kinase 6,CDK6,12,"The protein encoded by this gene is a member of the CMGC family of serine/threonine protein kinases. This kinase is a catalytic subunit of the protein kinase complex that is important for cell cycle G1 phase progression and G1/S transition. The activity of this kinase first appears in mid-G1 phase, which is controlled by the regulatory subunits including D-type cyclins and members of INK4 family of CDK inhibitors. This kinase, as well as CDK4, has been shown to phosphorylate, and thus regulate the activity of, tumor suppressor protein Rb. Altered expression of this gene has been observed in multiple human cancers. A mutation in this gene resulting in reduced cell proliferation, and impaired cell motility and polarity, and has been identified in patients with primary microcephaly. [provided by RefSeq, Aug 2017].","['Protein kinase domain', 'Serine/threonine-protein kinase, active site', 'Protein kinase-like domain superfamily', 'Protein kinase, ATP binding site', 'Cyclin-dependent kinase 6', 'Cyclin-dependent kinase']"
cyclin dependent kinase 4,CDK4,13,"The protein encoded by this gene is a member of the Ser/Thr protein kinase family. This protein is highly similar to the gene products of S. cerevisiae cdc28 and S. pombe cdc2. It is a catalytic subunit of the protein kinase complex that is important for cell cycle G1 phase progression. The activity of this kinase is restricted to the G1-S phase, which is controlled by the regulatory subunits D-type cyclins and CDK inhibitor p16(INK4a). This kinase was shown to be responsible for the phosphorylation of retinoblastoma gene product (Rb). Mutations in this gene as well as in its related proteins including D-type cyclins, p16(INK4a) and Rb were all found to be associated with tumorigenesis of a variety of cancers. Multiple polyadenylation sites of this gene have been reported. [provided by RefSeq, Jul 2008].","['Protein kinase domain', 'Protein kinase-like domain superfamily', 'Protein kinase, ATP binding site', 'Cyclin-dependent kinase', 'Serine/threonine-protein kinase, active site']"
cyclin dependent kinase inhibitor 2A,CDKN2A,14,"This gene generates several transcript variants which differ in their first exons. At least three alternatively spliced variants encoding distinct proteins have been reported, two of which encode structurally related isoforms known to function as inhibitors of CDK4 kinase. The remaining transcript includes an alternate first exon located 20 Kb upstream of the remainder of the gene; this transcript contains an alternate open reading frame (ARF) that specifies a protein which is structurally unrelated to the products of the other variants. This ARF product functions as a stabilizer of the tumor suppressor protein p53 as it can interact with, and sequester, the E3 ubiquitin-protein ligase MDM2, a protein responsible for the degradation of p53. In spite of the structural and functional differences, the CDK inhibitor isoforms and the ARF product encoded by this gene, through the regulatory roles of CDK4 and p53 in cell cycle G1 progression, share a common functionality in cell cycle G1 control. This gene is frequently mutated or deleted in a wide variety of tumors, and is known to be an important tumor suppressor gene. [provided by RefSeq, Sep 2012].","['Ankyrin repeat-containing domain superfamily', 'Ankyrin Repeat and Cyclin-Dependent Kinase Inhibitor', 'Tumor suppressor ARF']"
CCAAT enhancer binding protein alpha,CEBPA,15,"This intronless gene encodes a transcription factor that contains a basic leucine zipper (bZIP) domain and recognizes the CCAAT motif in the promoters of target genes. The encoded protein functions in homodimers and also heterodimers with CCAAT/enhancer-binding proteins beta and gamma. Activity of this protein can modulate the expression of genes involved in cell cycle regulation as well as in body weight homeostasis. Mutation of this gene is associated with acute myeloid leukemia. The use of alternative in-frame non-AUG (GUG) and AUG start codons results in protein isoforms with different lengths. Differential translation initiation is mediated by an out-of-frame, upstream open reading frame which is located between the GUG and the first AUG start codons. [provided by RefSeq, Dec 2013].","['Basic-leucine zipper domain', 'CCAAT/enhancer-binding protein, chordates', 'CCAAT/enhancer-binding protein C/EBP', 'Basic-leucine zipper domain superfamily']"
DNA methyltransferase 3 alpha,DNMT3A,18,"CpG methylation is an epigenetic modification that is important for embryonic development, imprinting, and X-chromosome inactivation. Studies in mice have demonstrated that DNA methylation is required for mammalian development. This gene encodes a DNA methyltransferase that is thought to function in de novo methylation, rather than maintenance methylation. The protein localizes to the cytoplasm and nucleus and its expression is developmentally regulated. [provided by RefSeq, Mar 2016].","['PWWP domain', 'C-5 cytosine methyltransferase', 'DNA methylase, C-5 cytosine-specific, active site', 'ADD domain', 'S-adenosyl-L-methionine-dependent methyltransferase superfamily', 'DNMT3, cysteine rich ADD domain, GATA1-like zinc finger', 'DNA (cytosine-5)-methyltransferase 3A, ADD domain', 'DNMT3, ADD domain, PHD zinc finger']"
epidermal growth factor receptor,EGFR,19,"The protein encoded by this gene is a transmembrane glycoprotein that is a member of the protein kinase superfamily. This protein is a receptor for members of the epidermal growth factor family. EGFR is a cell surface protein that binds to epidermal growth factor, thus inducing receptor dimerization and tyrosine autophosphorylation leading to cell proliferation. Mutations in this gene are associated with lung cancer. EGFR is a component of the cytokine storm which contributes to a severe form of Coronavirus Disease 2019 (COVID-19) resulting from infection with severe acute respiratory syndrome coronavirus-2 (SARS-CoV-2). [provided by RefSeq, Jul 2020].","['Protein kinase domain', 'Serine-threonine/tyrosine-protein kinase, catalytic domain', 'Furin-like repeat', 'Tyrosine-protein kinase, active site', 'Growth factor receptor cysteine-rich domain superfamily', 'Protein kinase-like domain superfamily', 'Protein kinase, ATP binding site', 'Tyrosine-protein kinase, catalytic domain', 'Growth factor receptor domain 4', 'Epidermal growth factor receptor-like, transmembrane-juxtamembrane segment', 'Receptor Tyrosine Kinase', 'Receptor L-domain', 'Furin-like cysteine-rich domain', 'Tyrosine protein kinase, EGF/ERB/XmrK receptor', 'Receptor L-domain superfamily']"
erb-b2 receptor tyrosine kinase 2,ERBB2,20,"This gene encodes a member of the epidermal growth factor (EGF) receptor family of receptor tyrosine kinases. This protein has no ligand binding domain of its own and therefore cannot bind growth factors. However, it does bind tightly to other ligand-bound EGF receptor family members to form a heterodimer, stabilizing ligand binding and enhancing kinase-mediated activation of downstream signalling pathways, such as those involving mitogen-activated protein kinase and phosphatidylinositol-3 kinase. Allelic variations at amino acid positions 654 and 655 of isoform a (positions 624 and 625 of isoform b) have been reported, with the most common allele, Ile654/Ile655, shown here. Amplification and/or overexpression of this gene has been reported in numerous cancers, including breast and ovarian tumors. Alternative splicing results in several additional transcript variants, some encoding different isoforms and others that have not been fully characterized. [provided by RefSeq, Jul 2008].","['Protein kinase domain', 'Serine-threonine/tyrosine-protein kinase, catalytic domain', 'Tyrosine-protein kinase, active site', 'Protein kinase-like domain superfamily', 'Protein kinase, ATP binding site', 'Tyrosine-protein kinase, catalytic domain', 'Epidermal growth factor receptor-like, transmembrane-juxtamembrane segment', 'Receptor Tyrosine Kinase', 'Furin-like cysteine-rich domain', 'Furin-like repeat', 'Growth factor receptor cysteine-rich domain superfamily', 'Growth factor receptor domain 4', 'Receptor L-domain superfamily', 'Receptor L-domain', 'Tyrosine protein kinase, EGF/ERB/XmrK receptor']"
estrogen receptor 1,ESR1,21,"This gene encodes an estrogen receptor and ligand-activated transcription factor. The canonical protein contains an N-terminal ligand-independent transactivation domain, a central DNA binding domain, a hinge domain, and a C-terminal ligand-dependent transactivation domain. The protein localizes to the nucleus where it may form either a homodimer or a heterodimer with estrogen receptor 2. The protein encoded by this gene regulates the transcription of many estrogen-inducible genes that play a role in growth, metabolism, sexual development, gestation, and other reproductive functions and is expressed in many non-reproductive tissues. The receptor encoded by this gene plays a key role in breast cancer, endometrial cancer, and osteoporosis. This gene is reported to have dozens of transcript variants due to the use of alternate promoters and alternative splicing, however, the full-length nature of many of these variants remain uncertain. [provided by RefSeq, Jul 2020].","['Estrogen receptor', 'Estrogen receptor, N-terminal', 'Nuclear hormone receptor, ligand-binding domain', 'Zinc finger, nuclear hormone receptor-type', 'Nuclear hormone receptor', 'Zinc finger, NHR/GATA-type', 'Estrogen receptor/oestrogen-related receptor', 'Oestrogen-type nuclear receptor final C-terminal domain', 'Nuclear hormone receptor-like domain superfamily', 'Nuclear hormone receptor family NR3 subfamily']"
