fullName,name,gene_id,summary,Protein_Domains
lysine methyltransferase 2A,KMT2A,3537,"This gene encodes a transcriptional coactivator that plays an essential role in regulating gene expression during early development and hematopoiesis. The encoded protein contains multiple conserved functional domains. One of these domains, the SET domain, is responsible for its histone H3 lysine 4 (H3K4) methyltransferase activity which mediates chromatin modifications associated with epigenetic transcriptional activation. This protein is processed by the enzyme Taspase 1 into two fragments, MLL-C and MLL-N. These fragments reassociate and further assemble into different multiprotein complexes that regulate the transcription of specific target genes, including many of the HOX genes. Multiple chromosomal translocations involving this gene are the cause of certain acute lymphoid leukemias and acute myeloid leukemias. Alternate splicing results in multiple transcript variants.[provided by RefSeq, Oct 2010].","['FY-rich, N-terminal', 'FY-rich, C-terminal', 'Zinc finger, RING/FYVE/PHD-type', 'Extended PHD (ePHD) domain', 'Bromodomain', 'Bromodomain-like superfamily', 'Zinc finger, PHD-type', 'Zinc finger, FYVE/PHD-type', 'Zinc finger, PHD-type, conserved site', 'Zinc finger, PHD-finger', 'KMT2A, PHD domain 3', 'SET domain', 'Zinc finger, CXXC-type', 'Post-SET domain', 'Methyltransferase, trithorax', 'KMT2A, ePHD domain', 'KMT2A, PHD domain 2', 'SET domain superfamily', 'Histone-lysine N-methyltransferase 2A/2B, SET domain', 'KMT2A, PHD domain 1']"
matrix metallopeptidase 2,MMP2,3549,"This gene is a member of the matrix metalloproteinase (MMP) gene family, that are zinc-dependent enzymes capable of cleaving components of the extracellular matrix and molecules involved in signal transduction. The protein encoded by this gene is a gelatinase A, type IV collagenase, that contains three fibronectin type II repeats in its catalytic site that allow binding of denatured type IV and V collagen and elastin. Unlike most MMP family members, activation of this protein can occur on the cell membrane. This enzyme can be activated extracellularly by proteases, or, intracellulary by its S-glutathiolation with no requirement for proteolytical removal of the pro-domain. This protein is thought to be involved in multiple pathways including roles in the nervous system, endometrial menstrual breakdown, regulation of vascularization, and metastasis. Mutations in this gene have been associated with Winchester syndrome and Nodulosis-Arthropathy-Osteolysis (NAO) syndrome. Alternative splicing results in multiple transcript variants encoding different isoforms. [provided by RefSeq, Oct 2014].","['Hemopexin-like domain', 'Peptidase M10, metallopeptidase', 'Hemopexin, conserved site', 'Hemopexin-like repeats', 'Peptidase M10A', 'Metallopeptidase, catalytic domain superfamily', 'Hemopexin-like domain superfamily', 'Fibronectin type II domain', 'Peptidoglycan binding-like', 'Peptidase, metallopeptidase', 'Kringle-like fold', 'Peptidase M10A, cysteine switch, zinc binding site', 'Peptidase M10A, catalytic domain', 'Fibronectin type II domain superfamily', 'PGBD-like superfamily']"
matrix metallopeptidase 9,MMP9,3553,"Proteins of the matrix metalloproteinase (MMP) family are involved in the breakdown of extracellular matrix in normal physiological processes, such as embryonic development, reproduction, and tissue remodeling, as well as in disease processes, such as arthritis and metastasis. Most MMP's are secreted as inactive proproteins which are activated when cleaved by extracellular proteinases. The enzyme encoded by this gene degrades type IV and V collagens. Studies in rhesus monkeys suggest that the enzyme is involved in IL-8-induced mobilization of hematopoietic progenitor cells from bone marrow, and murine studies suggest a role in tumor-associated tissue remodeling. [provided by RefSeq, Jul 2008].","['Fibronectin type II domain', 'Hemopexin-like domain', 'Peptidase M10, metallopeptidase', 'Peptidase, metallopeptidase', 'Kringle-like fold', 'Hemopexin, conserved site', 'Hemopexin-like repeats', 'Peptidase M10A, cysteine switch, zinc binding site', 'Peptidase M10A', 'Metallopeptidase, catalytic domain superfamily', 'Peptidase M10A, catalytic domain', 'PGBD-like superfamily', 'Hemopexin-like domain superfamily', 'Fibronectin type II domain superfamily']"
"MN1 proto-oncogene, transcriptional regulator",MN1,3564,"Meningioma 1 (MN1) contains two sets of CAG repeats. It is disrupted by a balanced translocation (4;22) in a meningioma, and its inactivation may contribute to meningioma 32 pathogenesis. [provided by RefSeq, Jul 2008].",[]
"MPL proto-oncogene, thrombopoietin receptor",MPL,3577,"In 1990 an oncogene, v-mpl, was identified from the murine myeloproliferative leukemia virus that was capable of immortalizing bone marrow hematopoietic cells from different lineages. In 1992 the human homologue, named, c-mpl, was cloned. Sequence data revealed that c-mpl encoded a protein that was homologous with members of the hematopoietic receptor superfamily. Presence of anti-sense oligodeoxynucleotides of c-mpl inhibited megakaryocyte colony formation. The ligand for c-mpl, thrombopoietin, was cloned in 1994. Thrombopoietin was shown to be the major regulator of megakaryocytopoiesis and platelet formation. The protein encoded by the c-mpl gene, CD110, is a 635 amino acid transmembrane domain, with two extracellular cytokine receptor domains and two intracellular cytokine receptor box motifs . TPO-R deficient mice were severely thrombocytopenic, emphasizing the important role of CD110 and thrombopoietin in megakaryocyte and platelet formation. Upon binding of thrombopoietin CD110 is dimerized and the JAK family of non-receptor tyrosine kinases, as well as the STAT family, the MAPK family, the adaptor protein Shc and the receptors themselves become tyrosine phosphorylated. [provided by RefSeq, Jul 2008].","['Long hematopoietin receptor, single chain, conserved site', 'Fibronectin type III', 'Immunoglobulin-like fold', 'Growth hormone/erythropoietin receptor, ligand binding', 'Fibronectin type III superfamily']"
"MRE11 homolog, double strand break repair nuclease",MRE11,3586,"This gene encodes a nuclear protein involved in homologous recombination, telomere length maintenance, and DNA double-strand break repair. By itself, the protein has 3' to 5' exonuclease activity and endonuclease activity. The protein forms a complex with the RAD50 homolog; this complex is required for nonhomologous joining of DNA ends and possesses increased single-stranded DNA endonuclease and 3' to 5' exonuclease activities. In conjunction with a DNA ligase, this protein promotes the joining of noncomplementary ends in vitro using short homologies near the ends of the DNA fragments. This gene has a pseudogene on chromosome 3. Alternative splicing of this gene results in two transcript variants encoding different isoforms. [provided by RefSeq, Jul 2008].","['Calcineurin-like phosphoesterase domain, ApaH type', 'Metallo-dependent phosphatase-like', 'Mre11 nuclease, N-terminal metallophosphatase domain', 'DNA double-strand break repair protein Mre11', 'Mre11, DNA-binding', 'Mre11, capping domain']"
mutS homolog 2,MSH2,3628,"This locus is frequently mutated in hereditary nonpolyposis colon cancer (HNPCC). When cloned, it was discovered to be a human homolog of the E. coli mismatch repair gene mutS, consistent with the characteristic alterations in microsatellite sequences (RER+ phenotype) found in HNPCC. Two transcript variants encoding different isoforms have been found for this gene. [provided by RefSeq, Apr 2012].","['DNA mismatch repair protein MutS, C-terminal', 'DNA mismatch repair protein MutS-like, N-terminal', 'DNA mismatch repair protein MutS, core', 'DNA mismatch repair protein MutS, connector domain', 'DNA mismatch repair protein MutS, clamp', 'DNA mismatch repair Msh2-type', 'DNA mismatch repair protein MutS, N-terminal', 'P-loop containing nucleoside triphosphate hydrolase', 'DNA mismatch repair protein Msh2, ATP-binding cassette domain', 'DNA mismatch repair protein MutS, core domain superfamily', 'MutS, connector domain superfamily', 'DNA mismatch repair MutS family']"
mutS homolog 3,MSH3,3629,"The protein encoded by this gene forms a heterodimer with MSH2 to form MutS beta, part of the post-replicative DNA mismatch repair system. MutS beta initiates mismatch repair by binding to a mismatch and then forming a complex with MutL alpha heterodimer. This gene contains a polymorphic 9 bp tandem repeat sequence in the first exon. The repeat is present 6 times in the reference genome sequence and 3-7 repeats have been reported. Defects in this gene are a cause of susceptibility to endometrial cancer. [provided by RefSeq, Mar 2011].","['DNA mismatch repair protein MutS, C-terminal', 'DNA mismatch repair protein MutS-like, N-terminal', 'DNA mismatch repair protein MutS, core', 'DNA mismatch repair protein MutS, connector domain', 'DNA mismatch repair protein MutS, N-terminal', 'DNA mismatch repair protein MutS/MSH', 'P-loop containing nucleoside triphosphate hydrolase', 'DNA mismatch repair protein MutS, core domain superfamily', 'MutS, connector domain superfamily', 'DNA mismatch repair MutS family']"
methylthioadenosine phosphorylase,MTAP,3659,"This gene encodes an enzyme that plays a major role in polyamine metabolism and is important for the salvage pathway of both adenine and methionine. The encoded enzyme is deficient in many cancers. Multiple alternatively spliced transcript variants have been described for this gene. [provided by RefSeq, Sep 2021].","['Nucleoside phosphorylase domain', 'Methylthioadenosine phosphorylase (MTAP)', 'Nucleoside phosphorylase superfamily', 'Purine phosphorylase, family 2, conserved site']"
methylenetetrahydrofolate reductase,MTHFR,3672,"The protein encoded by this gene catalyzes the conversion of 5,10-methylenetetrahydrofolate to 5-methyltetrahydrofolate, a co-substrate for homocysteine remethylation to methionine. Genetic variation in this gene influences susceptibility to occlusive vascular disease, neural tube defects, colon cancer and acute leukemia, and mutations in this gene are associated with methylenetetrahydrofolate reductase deficiency.[provided by RefSeq, Oct 2009].","['Methylenetetrahydrofolate reductase-like', 'Eukaryotic-type methylenetetrahydrofolate reductase', 'FAD-linked oxidoreductase-like', 'MTHFR, SAM-binding regulatory domain']"
"MYB proto-oncogene, transcription factor",MYB,3730,"This gene encodes a protein with three HTH DNA-binding domains that functions as a transcription regulator. This protein plays an essential role in the regulation of hematopoiesis. This gene may be aberrently expressed or rearranged or undergo translocation in leukemias and lymphomas, and is considered to be an oncogene. Alternative splicing results in multiple transcript variants. [provided by RefSeq, Jan 2016].","['SANT/Myb domain', 'Homedomain-like superfamily', 'Transcription regulator Wos2-domain', 'Myb domain', 'MYB Transcription Factors', 'C-myb, C-terminal']"
MYB proto-oncogene like 1,MYBL1,3731,"Enables DNA-binding transcription activator activity, RNA polymerase II-specific and RNA polymerase II cis-regulatory region sequence-specific DNA binding activity. Involved in positive regulation of transcription by RNA polymerase II. Located in nucleoplasm. [provided by Alliance of Genome Resources, Apr 2022]","['SANT/Myb domain', 'Homedomain-like superfamily', 'Transcription regulator Wos2-domain', 'C-myb, C-terminal', 'Myb domain', 'MYB Transcription Factors']"
"MYC proto-oncogene, bHLH transcription factor",MYC,3737,"This gene is a proto-oncogene and encodes a nuclear phosphoprotein that plays a role in cell cycle progression, apoptosis and cellular transformation. The encoded protein forms a heterodimer with the related transcription factor MAX. This complex binds to the E box DNA consensus sequence and regulates the transcription of specific target genes. Amplification of this gene is frequently observed in numerous human cancers. Translocations involving this gene are associated with Burkitt lymphoma and multiple myeloma in human patients. There is evidence to show that translation initiates both from an upstream, in-frame non-AUG (CUG) and a downstream AUG start site, resulting in the production of two isoforms with distinct N-termini. [provided by RefSeq, Aug 2017].","['Transcription regulator Myc', 'Leucine zipper, Myc', 'Myc-type, basic helix-loop-helix (bHLH) domain', 'Transcription regulator Myc, N-terminal', 'Helix-loop-helix DNA-binding domain superfamily', 'Myc family transcription factors']"
"MYCL proto-oncogene, bHLH transcription factor",MYCL,3738,"Predicted to enable DNA-binding transcription factor activity, RNA polymerase II-specific and RNA polymerase II cis-regulatory region sequence-specific DNA binding activity. Predicted to be involved in regulation of transcription by RNA polymerase II. Predicted to act upstream of or within regulation of inner ear auditory receptor cell differentiation. Located in chromosome and nucleoplasm. [provided by Alliance of Genome Resources, Apr 2022]","['Transcription regulator Myc', 'Myc-type, basic helix-loop-helix (bHLH) domain', 'Transcription regulator Myc, N-terminal', 'Helix-loop-helix DNA-binding domain superfamily', 'Myc family transcription factors']"
"MYCN proto-oncogene, bHLH transcription factor",MYCN,3741,"This gene is a member of the MYC family and encodes a protein with a basic helix-loop-helix (bHLH) domain. This protein is located in the nucleus and must dimerize with another bHLH protein in order to bind DNA. Amplification of this gene is associated with a variety of tumors, most notably neuroblastomas. Multiple alternatively spliced transcript variants encoding different isoforms have been found for this gene. [provided by RefSeq, Jun 2014].","['Transcription regulator Myc', 'Myc-type, basic helix-loop-helix (bHLH) domain', 'Transcription regulator Myc, N-terminal', 'Helix-loop-helix DNA-binding domain superfamily', 'Myc family transcription factors']"
MYD88 innate immune signal transduction adaptor,MYD88,3742,"This gene encodes a cytosolic adapter protein that plays a central role in the innate and adaptive immune response. This protein functions as an essential signal transducer in the interleukin-1 and Toll-like receptor signaling pathways. These pathways regulate that activation of numerous proinflammatory genes. The encoded protein consists of an N-terminal death domain and a C-terminal Toll-interleukin1 receptor domain. Patients with defects in this gene have an increased susceptibility to pyogenic bacterial infections. Alternate splicing results in multiple transcript variants. [provided by RefSeq, Feb 2010].","['Toll/interleukin-1 receptor homology (TIR) domain', 'Death domain', 'Death-like domain superfamily', 'Myeloid differentiation primary response protein MyD88', 'MyD88, death domain', 'Toll/interleukin-1 receptor homology (TIR) domain superfamily']"
myogenic differentiation 1,MYOD1,3777,"This gene encodes a nuclear protein that belongs to the basic helix-loop-helix family of transcription factors and the myogenic factors subfamily. It regulates muscle cell differentiation by inducing cell cycle arrest, a prerequisite for myogenic initiation. The protein is also involved in muscle regeneration. It activates its own transcription which may stabilize commitment to myogenesis. [provided by RefSeq, Jul 2008].","['Myogenic muscle-specific protein, N-terminal', 'Myc-type, basic helix-loop-helix (bHLH) domain', 'Myogenic determination factor 5', 'Helix-loop-helix DNA-binding domain superfamily', 'Myogenic factor']"
nibrin,NBN,3801,"Mutations in this gene are associated with Nijmegen breakage syndrome, an autosomal recessive chromosomal instability syndrome characterized by microcephaly, growth retardation, immunodeficiency, and cancer predisposition. The encoded protein is a member of the MRE11/RAD50 double-strand break repair complex which consists of 5 proteins. This gene product is thought to be involved in DNA double-strand break repair and DNA damage-induced checkpoint activation. [provided by RefSeq, Jul 2008].","['Forkhead-associated (FHA) domain', 'BRCT domain', 'SMAD/FHA domain superfamily', 'Nibrin, second BRCT domain', 'BRCT domain superfamily', 'Nibrin-related', 'Nibrin, second BRCT domain superfamily', 'Nibrin, C-terminal', 'Nibrin']"
"neural precursor cell expressed, developmentally down-regulated 9",NEDD9,3852,"The protein encoded by this gene is a member of the CRK-associated substrates family. Members of this family are adhesion docking molecules that mediate protein-protein interactions for signal transduction pathways. This protein is a focal adhesion protein that acts as a scaffold to regulate signaling complexes important in cell attachment, migration and invasion as well as apoptosis and the cell cycle. This protein has also been reported to have a role in cancer metastasis. Alternative splicing results in multiple transcript variants. [provided by RefSeq, Aug 2012].","['SH3 domain', 'SH3-like domain superfamily', 'CAS family', 'Enhancer of filamentation 1, SH3 domain', 'Serine rich protein interaction domain', 'CAS family, C-terminal', 'CAS, serine rich four helix bundle domain superfamily']"
neurofibromin 1,NF1,3867,"This gene product appears to function as a negative regulator of the ras signal transduction pathway. Mutations in this gene have been linked to neurofibromatosis type 1, juvenile myelomonocytic leukemia and Watson syndrome. The mRNA for this gene is subject to RNA editing (CGA>UGA->Arg1306Term) resulting in premature translation termination. Alternatively spliced transcript variants encoding different isoforms have also been described for this gene. [provided by RefSeq, Jul 2008].","['Translation release factor pelota', 'Armadillo-type fold', 'CRAL-TRIO lipid binding domain', 'Ras GTPase-activating domain', 'Rho GTPase activation protein', 'PH-like domain superfamily', 'Ras GTPase-activating protein, conserved site', 'CRAL-TRIO lipid binding domain superfamily', 'Ras GTPase-activating protein', 'Neurofibromin, PH domain-like']"
"NF2, moesin-ezrin-radixin like (MERLIN) tumor suppressor",NF2,3870,"This gene encodes a protein that is similar to some members of the ERM (ezrin, radixin, moesin) family of proteins that link cytoskeletal components with proteins in the cell membrane. The encoded protein is involved in regulation of contact-dependent inhibition of cell proliferation and functions in cell-cell adhesion and transmembrane signaling. The encoded protein has been shown to interact with cell-surface proteins, proteins involved in cytoskeletal dynamics, and proteins involved in regulating ion transport. Disruption of this protein's function has been implicated in tumorigenesis and metastasis. Mutations in this gene are associated with neurofibromatosis type II which is characterized by nervous system and skin tumors and ocular abnormalities. [provided by RefSeq, May 2022].","['FERM domain', 'Ezrin/radixin/moesin-like', 'Moesin tail domain superfamily', 'Ezrin/radixin/moesin', 'Ezrin/radixin/moesin, C-terminal', 'PH-like domain superfamily', 'FERM/acyl-CoA-binding protein superfamily', 'FERM, N-terminal', 'FERM, C-terminal PH-like domain', 'FERM conserved site', 'FERM central domain', 'Band 4.1 domain', 'Ubiquitin-like domain superfamily', 'FERM superfamily, second domain', 'ERM family, FERM domain C-lobe', 'Ezrin/radixin/moesin, alpha-helical domain']"
NFE2 like bZIP transcription factor 2,NFE2L2,3878,"This gene encodes a transcription factor which is a member of a small family of basic leucine zipper (bZIP) proteins. The encoded transcription factor regulates genes which contain antioxidant response elements (ARE) in their promoters; many of these genes encode proteins involved in response to injury and inflammation which includes the production of free radicals. Multiple transcript variants encoding different isoforms have been characterized for this gene. [provided by RefSeq, Sep 2015].","['Nuclear Factor Erythroid-derived 2-like', 'Basic leucine zipper domain, Maf-type', 'Basic-leucine zipper domain', 'Transcription factor, Skn-1-like, DNA-binding domain superfamily', 'Basic-leucine zipper domain superfamily']"
NFKB inhibitor alpha,NFKBIA,3885,"This gene encodes a member of the NF-kappa-B inhibitor family, which contain multiple ankrin repeat domains. The encoded protein interacts with REL dimers to inhibit NF-kappa-B/REL complexes which are involved in inflammatory responses. The encoded protein moves between the cytoplasm and the nucleus via a nuclear localization signal and CRM1-mediated nuclear export. Mutations in this gene have been found in ectodermal dysplasia anhidrotic with T-cell immunodeficiency autosomal dominant disease. [provided by RefSeq, Aug 2011].","['Ankyrin repeat', 'Ankyrin repeat-containing domain superfamily', 'NF-kappa-B Inhibitor']"
NFKB inhibitor epsilon,NFKBIE,3887,"The protein encoded by this gene binds to components of NF-kappa-B, trapping the complex in the cytoplasm and preventing it from activating genes in the nucleus. Phosphorylation of the encoded protein targets it for destruction by the ubiquitin pathway, which activates NF-kappa-B by making it available to translocate to the nucleus. [provided by RefSeq, Sep 2011].","['Ankyrin repeat', 'Ankyrin repeat-containing domain superfamily', 'NF-kappa-B Inhibitor']"
notch receptor 2,NOTCH2,3935,"This gene encodes a member of the Notch family. Members of this Type 1 transmembrane protein family share structural characteristics including an extracellular domain consisting of multiple epidermal growth factor-like (EGF) repeats, and an intracellular domain consisting of multiple, different domain types. Notch family members play a role in a variety of developmental processes by controlling cell fate decisions. The Notch signaling network is an evolutionarily conserved intercellular signaling pathway which regulates interactions between physically adjacent cells. In Drosophilia, notch interaction with its cell-bound ligands (delta, serrate) establishes an intercellular signaling pathway that plays a key role in development. Homologues of the notch-ligands have also been identified in human, but precise interactions between these ligands and the human notch homologues remain to be determined. This protein is cleaved in the trans-Golgi network, and presented on the cell surface as a heterodimer. This protein functions as a receptor for membrane bound ligands, and may play a role in vascular, renal and hepatic development. Two transcript variants encoding different isoforms have been found for this gene. [provided by RefSeq, Jan 2011].","['EGF-like domain', 'EGF-like calcium-binding domain', 'Notch Signaling and Cell Fate Determination', 'EGF-type aspartate/asparagine hydroxylation site', 'EGF-like calcium-binding, conserved site', 'NOTCH1 EGF-like calcium-binding domain', 'Notch domain', 'Ankyrin repeat', 'Notch', 'Growth factor receptor cysteine-rich domain superfamily', 'Notch, NOD domain', 'Notch, NODP domain', 'EGF-like, conserved site', 'Neurogenic locus notch homolog protein 2', 'Notch, C-terminal', 'Notch-like domain superfamily', 'Ankyrin repeat-containing domain superfamily', 'Notch signaling pathway']"
notch receptor 3,NOTCH3,3936,"This gene encodes the third discovered human homologue of the Drosophilia melanogaster type I membrane protein notch. In Drosophilia, notch interaction with its cell-bound ligands (delta, serrate) establishes an intercellular signalling pathway that plays a key role in neural development. Homologues of the notch-ligands have also been identified in human, but precise interactions between these ligands and the human notch homologues remains to be determined. Mutations in NOTCH3 have been identified as the underlying cause of cerebral autosomal dominant arteriopathy with subcortical infarcts and leukoencephalopathy (CADASIL). [provided by RefSeq, Jul 2008].","['EGF-type aspartate/asparagine hydroxylation site', 'EGF-like domain', 'EGF-like calcium-binding domain', 'Ankyrin repeat', 'Growth factor receptor cysteine-rich domain superfamily', 'EGF-like, conserved site', 'EGF-like calcium-binding, conserved site', 'Ankyrin repeat-containing domain superfamily', 'NOTCH1 EGF-like calcium-binding domain', 'Notch signaling pathway', 'Notch domain', 'Notch', 'Notch, NOD domain', 'Notch, NODP domain', 'Neurogenic locus Notch 3', 'Notch, C-terminal', 'Notch-like domain superfamily']"
5'-nucleotidase ecto,NT5E,3976,"The protein encoded by this gene is a plasma membrane protein that catalyzes the conversion of extracellular nucleotides to membrane-permeable nucleosides. The encoded protein is used as a determinant of lymphocyte differentiation. Defects in this gene can lead to the calcification of joints and arteries. Two transcript variants encoding different isoforms have been found for this gene.[provided by RefSeq, Mar 2011].","['Calcineurin-like phosphoesterase domain, ApaH type', ""5'-Nucleotidase, conserved site"", ""5'-Nucleotidase/apyrase"", ""5'-Nucleotidase, C-terminal"", 'Metallo-dependent phosphatase-like', ""5'-Nucleotidase, C-terminal domain superfamily""]"
